{
  "contract_version": 1,
  "client_id": "00000000-0000-4000-8000-000000000004",
  "crop": "tomato",
  "lang": "en",
  "source": "server",
  "captured_at": "2026-10-29T10:00:00Z",
  "quality": {
    "ok": false,
    "blur": 31.0,
    "brightness": 0.48,
    "leaf_ratio": 0.55,
    "reason_key": "quality.too_blurry"
  },
  "classifier": null,
  "verdict": {
    "status": "retake",
    "label": null,
    "confidence": null
  },
  "weather_risk": {
    "level": "high",
    "rule": "hutton",
    "source": "open-meteo",
    "fetched_at": "2026-10-29T10:00:05+00:00",
    "days": [
      {
        "date": "2026-10-30",
        "favourable": true
      },
      {
        "date": "2026-10-31",
        "favourable": true
      },
      {
        "date": "2026-11-01",
        "favourable": false
      }
    ]
  },
  "soil": {
    "moisture": 0.21,
    "temperature_c": 24.5,
    "irrigation_key": "wait_for_rain",
    "card_values": null,
    "flags": []
  },
  "advice": {
    "summary": "[stub] We could not be sure. Take another photo or call the Kisan Call Centre.",
    "steps": [
      {
        "text": "[stub] Take a clear photo of one leaf in daylight.",
        "citation_id": null
      },
      {
        "text": "[stub] Call 1800-180-1551 (free) for expert help.",
        "citation_id": null
      }
    ],
    "citations": []
  },
  "escalation": {
    "kcc_phone": "1800-180-1551"
  }
}
